dataset_id,title_fr,description_fr
DS_ERFS_MENAGE,Indicateurs de revenu disponible (au niveau des ménages pour le dernier millésime disponible),"Les indicateurs sont calculés au niveau du ménage.
II y a le nombre de ménages, des indicateurs sur le revenu disponible (1er et 9e décile, médiane, moyenne) ainsi que la décomposition du revenu disponible (part des revenus d'activités, des retraites ou pensions, des revenus du patrimoine, des prestations sociales et des impôts directs).

Le champ comprend les ménages ordinaires de France métropolitaine dont le revenu déclaré est positif ou nul et dont la personne de référence n'est pas étudiante."
DS_ERFS_MENAGE_SL,Indicateurs de revenu disponible et de pauvreté (pour les ménages en série longue),"Les indicateurs sont calculés au niveau du ménage.
Les indicateurs sur le revenu disponible du ménage sont la moyenne, la médiane ainsi que le 1er et le 9e décile.
Il y a aussi le nombre de ménages pauvres (au seuil de 60 %) et le nombre de ménages.
Certains indicateurs sont calculés sur des sous-population pour la personne de référence (actifs, 18 ans et plus, retraités).

Le champ comprend les ménages ordinaires de France métropolitaine dont le revenu déclaré est positif ou nul et dont la personne de référence n'est pas étudiante."
DS_FILOSOFI_CC,"Principaux indicateurs sur la pauvreté en 2021 : niveau de vie, taux de pauvreté, part des ménages imposés et décomposition du revenu disponible","- Nombre de ménages fiscaux, de personnes et d’unités de consommation
- Part des ménages imposés
- Indicateurs de distribution du niveau de vie : médiane, 1er et 9e déciles, rapport interdécile
- Décomposition du revenu disponible (part des revenus d'activité, des retraites ou pension, des revenus du patrimoine, prestations sociales et des impôts directs)
- Taux de pauvreté à 60 % du niveau de vie médian de la France métropolitaine

Le champ couvert est celui de l'ensemble des ménages fiscaux ordinaires. La part des ménages fiscaux imposés est calculée sur le champ des ménages dont le revenu déclaré est positif ou nul. Les autres indicateurs sont calculés sur le champ des ménages dont le revenu disponible est positif ou nul.
Les résultats couvrent la France métropolitaine, la Martinique et La Réunion.

Les données sont disponibles aux échelons géographiques suivants : France métropolitaine, région, département, arrondissement, établissement public de coopération intercommunale (EPCI), établissement public territorial (EPT), collectivité territoriale à compétences départementales (CTCD), commune, arrondissement municipal, aire d’attraction des villes 2020, bassin de vie 2022, unité urbaine 2020, zone d’emploi 2020."
